{
  "generated_at": "2026-07-01T09:30:00",
  "gerado_por": "universal_intake_adapter.py",
  "contrato": "MEGATRON Core Spec v0.1",
  "resumo": {
    "total": 5,
    "aguardando_fabio": 4,
    "sensiveis": 2
  },
  "cores_status": {
    "waiting_approval": "amarelo",
    "archived": "cinza",
    "blocked": "vermelho",
    "classified": "azul"
  },
  "fila": [
    {
      "id": "intake_20260701T090000_f7aaa68ba3c7",
      "source": "gmail",
      "received_at": "2026-07-01T09:00:00-03:00",
      "sender": "coordenacao@escola.exemplo",
      "subject": "Prova 8o ano",
      "raw_content_ref": "60_Sistemas/MEGATRON/v1/state/_raw/intake_20260701T090000_f7aaa68ba3c7.txt (gitignored, nao versionado)",
      "summary": "Fabio, precisamos da prova do 8o ano sobre Africa ate amanha, urgente.",
      "domain": "escolaos",
      "sensitivity": "internal",
      "urgency": "high",
      "suggested_agent": "agente_escolar",
      "suggested_action": "criar_tarefa",
      "alerta": true,
      "requires_human_approval": true,
      "rag_permitido": true,
      "status": "waiting_approval",
      "log_ref": "intake_log.jsonl"
    },
    {
      "id": "intake_20260701T090500_a6b39d604db8",
      "source": "whatsapp",
      "received_at": "2026-07-01T09:05:00-03:00",
      "sender": "+5511999990001",
      "subject": "",
      "raw_content_ref": "60_Sistemas/MEGATRON/v1/state/_raw/intake_20260701T090500_a6b39d604db8.txt (gitignored, nao versionado)",
      "summary": "Bom dia, meu filho passou mal e vai faltar hoje, mando o atestado depois.",
      "domain": "saude",
      "sensitivity": "restricted",
      "urgency": "high",
      "suggested_agent": "humano_restrito",
      "suggested_action": "bloquear_e_escalar",
      "alerta": true,
      "requires_human_approval": true,
      "rag_permitido": false,
      "status": "waiting_approval",
      "log_ref": "intake_log.jsonl"
    },
    {
      "id": "intake_20260701T091000_085b9c2777f6",
      "source": "whatsapp",
      "received_at": "2026-07-01T09:10:00-03:00",
      "sender": "+5511999990002",
      "subject": "",
      "raw_content_ref": "60_Sistemas/MEGATRON/v1/state/_raw/intake_20260701T091000_085b9c2777f6.txt (gitignored, nao versionado)",
      "summary": "[REDIGIDO - credencial/segredo detectado; corpo retido fora da fila]",
      "domain": "seguranca",
      "sensitivity": "forbidden_external",
      "urgency": "medium",
      "suggested_agent": "bloqueio",
      "suggested_action": "bloquear_e_escalar",
      "alerta": true,
      "requires_human_approval": true,
      "rag_permitido": false,
      "status": "waiting_approval",
      "log_ref": "intake_log.jsonl"
    },
    {
      "id": "intake_20260701T091500_0781907939b8",
      "source": "pdf",
      "received_at": "2026-07-01T09:15:00-03:00",
      "sender": "drop/00_Inbox/pdfs/edital.pdf",
      "subject": "Edital municipal",
      "raw_content_ref": "60_Sistemas/MEGATRON/v1/state/_raw/intake_20260701T091500_0781907939b8.txt (gitignored, nao versionado)",
      "summary": "Edital de contratacao de professores substitutos, prazo de inscricao ate sexta.",
      "domain": "pessoal",
      "sensitivity": "internal",
      "urgency": "high",
      "suggested_agent": "megatron",
      "suggested_action": "criar_nota",
      "alerta": true,
      "requires_human_approval": true,
      "rag_permitido": true,
      "status": "waiting_approval",
      "log_ref": "intake_log.jsonl"
    },
    {
      "id": "intake_20260701T092000_e68826655f7b",
      "source": "gmail",
      "received_at": "2026-07-01T09:20:00-03:00",
      "sender": "promo@loja.exemplo",
      "subject": "OFERTA imperdivel",
      "raw_content_ref": "60_Sistemas/MEGATRON/v1/state/_raw/intake_20260701T092000_e68826655f7b.txt (gitignored, nao versionado)",
      "summary": "Ganhe 70% de desconto, clique aqui, oferta imperdivel so hoje!",
      "domain": "spam",
      "sensitivity": "public",
      "urgency": "high",
      "suggested_agent": "descarte",
      "suggested_action": "descartar",
      "alerta": true,
      "requires_human_approval": false,
      "rag_permitido": false,
      "status": "archived",
      "log_ref": "intake_log.jsonl"
    }
  ]
}
